<?xml version="1.0" encoding="UTF-8"?>
<xs:schema xmlns:xs="http://www.w3.org/2001/XMLSchema">

    <xs:element name="inscripciones">
        <xs:complexType>
            <xs:sequence>
                <xs:element name="inscripcion" maxOccurs="unbounded">
                    <xs:complexType>
                        <xs:sequence>

                            <xs:element name="nombre" type="xs:string"/>
                            
                            <xs:element name="correo" type="xs:string"/>
                            
                            <xs:element name="telefono">
                                <xs:simpleType>
                                    <xs:restriction base="xs:decimal">
                                        <xs:pattern value="[0-9]{9}"/>
                                    </xs:restriction>
                                </xs:simpleType>
                            </xs:element>
                            
                            <xs:element name="evento">
                                <xs:simpleType>
                                    <xs:restriction base="xs:string">
                                        <xs:enumeration value="ConferenciaTecnologia"/>
                                        <xs:enumeration value="TallerMarketing"/>
                                        <xs:enumeration value="EventoSolidario"/>
                                    </xs:restriction>
                                </xs:simpleType>
                            </xs:element>

                            <xs:element name="mensaje" type="xs:string" minOccurs="0"/>

                        </xs:sequence>
                    </xs:complexType>
                </xs:element>
            </xs:sequence>
        </xs:complexType>
    </xs:element>

</xs:schema>
